{"attempt_id":"attempt-p0-001","expansion_count":2,"expansion_identity_sha256":"ab0d05c9d91da16cdc4cb50d9d7e4dba5ed29d35084e4632f3241e3be4cc716c","expansions":[{"delivered_content_sha256":"b3cc0475bb78a5026098858e9889acf666d31062d513d303314eca31d36e72f2","delivered_utf8_bytes":9,"expansion_id":"expand-p0-001","source_byte_length":9,"source_byte_start":0,"source_content_sha256":"b3cc0475bb78a5026098858e9889acf666d31062d513d303314eca31d36e72f2","source_id":"source-p0-001","source_path":"src/synthetic.py","source_total_bytes":24},{"delivered_content_sha256":"ee8250fb76e094b34b471f13a73dbbe51d1ae142e9df59d7c0d31ec20f0a0a8e","delivered_utf8_bytes":8,"expansion_id":"expand-p0-002","source_byte_length":8,"source_byte_start":10,"source_content_sha256":"ee8250fb76e094b34b471f13a73dbbe51d1ae142e9df59d7c0d31ec20f0a0a8e","source_id":"source-p0-001","source_path":"src/synthetic.py","source_total_bytes":24}],"immutable_status":"immutable","pack_content_sha256":"151bbf4299a64602af9b954946354ce9ea90d273ab5e9c0286bd20c4ea9cacca","pack_identity_id":"pack-p0-001","pack_utf8_bytes":26,"root_policy_id":"root-v1","schema_version":"v1","selection_snapshot_id":"snapshot-p0-001"}
